artifact_id,artefact_group,filename,current_path,proposed_package_path,description,version,current_state,status_at_registration,pre_existing_or_prospective,access_class,registration_inclusion,sha256,created_or_modified_at,source_commit,authoritative_status,supersedes_or_superseded_by,notes,size_bytes,git_blob_oid,protocol_source_commit,protocol_source_commit_date,protocol_source_commit_message,implementation_last_checked_commit,metadata_generated_on,protocol_status,current_implementation_basis,frozen,registered,registration_identifier,registration_timestamp,official_sample_draw_authorised,supersedes,superseded_by,pending_gates,protocol_source_kind
RED-041,06_redcap,project_owner_redcap_data_dictionary_candidate_0.1.csv,preregistration/package/06_redcap/project_owner_redcap_data_dictionary_candidate_0.1.csv,preregistration/package/06_redcap/project_owner_redcap_data_dictionary_candidate_0.1.csv,Canonical generated standalone Project Owner REDCap development dictionary.,owner-redcap-candidate-0.1,historical_candidate,draft_template,prospective,public,include,e3b59478ff9e37a52964790340dc1a65daccb5381293a42883ed7eaf398c3114,2026-07-22T16:23:10+00:00,9fcabc3699ae2f047b7d33460c9867ab68457455,superseded_candidate,RED-054,"Immutable 152-field candidate 0.1; unfrozen, never imported, superseded by candidate 0.2 before live QA.",39310,,,,,,,,,,,,,,,,,
RED-042,06_redcap,project_owner_redcap_field_specification_candidate_0.1.csv,preregistration/package/06_redcap/project_owner_redcap_field_specification_candidate_0.1.csv,preregistration/package/06_redcap/project_owner_redcap_field_specification_candidate_0.1.csv,"Machine-readable standalone owner field, privacy, export and source specification.",owner-redcap-candidate-0.1,historical_candidate,draft_template,prospective,public,include,2a063a1a3fc68c97507cf99b96b8ae65c801b24fa669fc505e08b3919045a41a,2026-07-22T16:23:10+00:00,9fcabc3699ae2f047b7d33460c9867ab68457455,supporting_historical_candidate,RED-041,Generated deterministically; contains no records or responses.,28129,,,,,,,,,,,,,,,,,
RED-043,06_redcap,project_owner_redcap_branching_specification_candidate_0.1.yaml,preregistration/package/06_redcap/project_owner_redcap_branching_specification_candidate_0.1.yaml,preregistration/package/06_redcap/project_owner_redcap_branching_specification_candidate_0.1.yaml,"Machine-readable standalone owner branching, linkage, permission and completion specification.",owner-redcap-candidate-0.1,historical_candidate,draft_template,prospective,public,include,0341cce6577e631237de7a39875defc182a3a2bc45587ffd53c6843fde7b32cc,2026-07-22T16:23:10+00:00,9fcabc3699ae2f047b7d33460c9867ab68457455,supporting_historical_candidate,RED-041,Records Development PID 9149 only as a future synthetic-QA target; no connection occurred.,5319,,,,,,,,,,,,,,,,,
RED-044,06_redcap,project_owner_redcap_expected_export_candidate_0.1.csv,preregistration/package/06_redcap/project_owner_redcap_expected_export_candidate_0.1.csv,preregistration/package/06_redcap/project_owner_redcap_expected_export_candidate_0.1.csv,Expected standalone owner contact and analytical export specification.,owner-redcap-candidate-0.1,historical_candidate,draft_template,prospective,public,include,07a1e3e160977afc16f627e878e52d31f5bb8e1bb527839dbd3f63f484953138,2026-07-22T16:23:10+00:00,9fcabc3699ae2f047b7d33460c9867ab68457455,supporting_historical_candidate,RED-041,Excludes contact identifiers from the ordinary analytical export and documents deterministic completion.,14110,,,,,,,,,,,,,,,,,
RED-045,06_redcap,project_owner_synthetic_import_candidate_0.1.csv,preregistration/package/06_redcap/live_qa/project_owner_synthetic_import_candidate_0.1.csv,preregistration/package/06_redcap/live_qa/project_owner_synthetic_import_candidate_0.1.csv,Synthetic-only contact and assignment import fixture for later Development live QA.,owner-redcap-candidate-0.1,historical_candidate,draft_template,prospective,public,include,bbf7dfbea83362c395bcc4525bf7d3d6d0d559938ba8bd32044444f76537856b,2026-07-22T16:23:10+00:00,9fcabc3699ae2f047b7d33460c9867ab68457455,supporting_historical_candidate,RED-041; RED-047,"Fictional .invalid contacts and synthetic projects only; not a cohort, sample, formal assignment or collected response.",5953,,,,,,,,,,,,,,,,,
RED-046,06_redcap,project_owner_recruitment_materials_candidate_0.1.md,preregistration/package/06_redcap/project_owner_recruitment_materials_candidate_0.1.md,preregistration/package/06_redcap/project_owner_recruitment_materials_candidate_0.1.md,"Two-stage expression-of-interest, project-link, survey, withdrawal and permission templates.",owner-redcap-candidate-0.1,historical_candidate,draft_template,prospective,public,include,d1ee845665beaf390cf1a9885b6012ef479f8e135bd80d349ddf21ad1b735f2b,2026-07-22T16:22:50+00:00,9fcabc3699ae2f047b7d33460c9867ab68457455,supporting_historical_candidate,PRO-012; RED-041,Configuration placeholders only; no email or invitation was sent.,8067,,,,,,,,,,,,,,,,,
RED-047,06_redcap,project_owner_live_qa_plan_candidate_0.1.md,preregistration/package/06_redcap/project_owner_live_qa_plan_candidate_0.1.md,preregistration/package/06_redcap/project_owner_live_qa_plan_candidate_0.1.md,"Offline, admin-user, respondent-view and freeze QA plan for the standalone owner candidate.",owner-redcap-candidate-0.1,historical_candidate,draft_template,prospective,public,include,863fa752d0c2f5a8c9634a849a5ab327fbd8bcb8998ce42d5def316d1b5db093,2026-07-22T16:17:15+00:00,9fcabc3699ae2f047b7d33460c9867ab68457455,supporting_historical_candidate,RED-041; RED-045,PID 9149 is named only as the intended blank Development QA target; no live QA is claimed.,7129,,,,,,,,,,,,,,,,,
RED-048,06_redcap,project_owner_redcap_candidate_0.1_README.md,preregistration/package/06_redcap/project_owner_redcap_candidate_0.1_README.md,preregistration/package/06_redcap/project_owner_redcap_candidate_0.1_README.md,"Standalone Project Owner candidate architecture, status, hashes and gate guide.",owner-redcap-candidate-0.1,historical_candidate,draft_template,prospective,public,include,a0862452898ca0136b7f4cc850403b704c55bc2b15b0a4eb7a421f909c36ae1c,2026-07-22T16:18:08+00:00,9fcabc3699ae2f047b7d33460c9867ab68457455,supporting_historical_candidate,RED-041; RED-047,States explicitly that candidate 0.1 is unfrozen and has not been imported.,5215,,,,,,,,,,,,,,,,,
RED-049,06_redcap,project_owner_redcap_version_history.md,preregistration/package/06_redcap/project_owner_redcap_version_history.md,preregistration/package/06_redcap/project_owner_redcap_version_history.md,Standalone Project Owner REDCap candidate version history.,owner-redcap-history-0.3,working_candidate,draft_template,prospective,public,include,cdd0e1af91e2f90b1d8515219a55d493741a05fdd77d365d0f721067f90a05c9,2026-07-23T22:40:13+00:00,9fcabc3699ae2f047b7d33460c9867ab68457455,supporting_current_candidate,RED-041; RED-054; RED-068,Version history preserves candidates 0.1/0.2 and records the approved display pass plus reference-only boundary strengthening and participant/audit content separation within unfrozen candidate 0.3.,15437,,,,,,,,,,,,,,,,,
RED-050,06_redcap,build_project_owner_redcap_candidate.py,scripts/build_project_owner_redcap_candidate.py,preregistration/package/06_redcap/build_project_owner_redcap_candidate.py,Deterministic offline standalone Project Owner candidate builder.,owner-redcap-candidate-0.1,historical_candidate,draft_template,prospective,public,include,0de088f0ad1b7a0f93fdef07d57cca162c78857ae6dbe4c90db086a54cd6021a,2026-07-22T16:15:32+00:00,9fcabc3699ae2f047b7d33460c9867ab68457455,supporting_historical_candidate,RED-041; RED-042; RED-043; RED-044; RED-045; RED-052,"No network, API, REDCap, sampling or real-record behaviour.",40717,,,,,,,,,,,,,,,,,
RED-051,06_redcap,validate_project_owner_redcap_candidate.py,scripts/validate_project_owner_redcap_candidate.py,preregistration/package/06_redcap/validate_project_owner_redcap_candidate.py,"Offline standalone Project Owner dictionary, privacy, linkage, fixture and completion validator.",owner-redcap-candidate-0.1,historical_candidate,draft_template,prospective,public,include,a937f6d7330d9ee3ba8817122e7d4e9f3f639fdc05f8b79a45c2c414fa399c67,2026-07-22T16:15:01+00:00,9fcabc3699ae2f047b7d33460c9867ab68457455,supporting_historical_candidate,RED-041; RED-052,Validates synthetic data only and hash-checks frozen scratch candidate 0.7.,21143,,,,,,,,,,,,,,,,,
RED-052,06_redcap,project_owner_candidate_0_1_synthetic_submissions.yaml,tests/fixtures/project_owner_candidate_0_1_synthetic_submissions.yaml,preregistration/package/06_redcap/test_fixtures/project_owner_candidate_0_1_synthetic_submissions.yaml,"Synthetic standalone owner contact, assignment and response validation cases.",owner-redcap-candidate-0.1,historical_candidate,draft_template,prospective,public,include,9eeb8915dabce74a2f894f361fdb7106e5763d4e0debc54385f550bd6a8e584e,2026-07-22T16:23:10+00:00,9fcabc3699ae2f047b7d33460c9867ab68457455,supporting_historical_candidate,RED-041; RED-051,"Fictional names, .invalid emails and synthetic non-DEA record identifiers only.",10555,,,,,,,,,,,,,,,,,
RED-053,06_redcap,test_project_owner_redcap_candidate.py,tests/test_project_owner_redcap_candidate.py,preregistration/package/06_redcap/test_project_owner_redcap_candidate.py,Focused offline tests for the standalone Project Owner candidate.,owner-redcap-candidate-0.1,historical_candidate,draft_template,prospective,public,include,5077c83f272ddebc8f579375e3076fd1d544b59e36a7623323cd372d3af76960,2026-07-22T16:22:50+00:00,9fcabc3699ae2f047b7d33460c9867ab68457455,supporting_historical_candidate,RED-041; RED-050; RED-051; RED-052,"Covers exact counts, branches, identifiers, tags, permissions, completion, fixtures and frozen-scratch regression.",14912,,,,,,,,,,,,,,,,,
RED-054,06_redcap,project_owner_redcap_data_dictionary_candidate_0.2.csv,preregistration/package/06_redcap/project_owner_redcap_data_dictionary_candidate_0.2.csv,preregistration/package/06_redcap/project_owner_redcap_data_dictionary_candidate_0.2.csv,Canonical generated standalone Project Owner candidate with one-time researcher-level informed consent.,owner-redcap-candidate-0.2,historical_candidate,draft_template,prospective,public,include,8225aec9afaae533151fa66e484b7361d8292777e9398b5a722fdc58b1fd52ec,2026-07-22T18:27:30+00:00,9fcabc3699ae2f047b7d33460c9867ab68457455,superseded_unfrozen_candidate,RED-002; RED-041; RED-068,"Exactly 167 fields across 31/12/39/85 forms; unfrozen, not imported, synthetic live QA pending. Superseded by candidate 0.3 before recruitment; this candidate-0.2 file remains unchanged.",41753,,,,,,,,,,,,,,,,,
RED-055,06_redcap,project_owner_redcap_field_specification_candidate_0.2.csv,preregistration/package/06_redcap/project_owner_redcap_field_specification_candidate_0.2.csv,preregistration/package/06_redcap/project_owner_redcap_field_specification_candidate_0.2.csv,"Machine-readable candidate-0.2 field, privacy, export and source specification.",owner-redcap-candidate-0.2,historical_candidate,draft_template,prospective,public,include,97d73d402dd18f9b5312b997cb278fe90c3326d9a83a0838a2d6f0f265d7d014,2026-07-22T18:27:30+00:00,9fcabc3699ae2f047b7d33460c9867ab68457455,supporting_historical_candidate,RED-054; RED-068,Generated deterministically; contains no records or responses. Superseded by candidate 0.3 before recruitment; this candidate-0.2 file remains unchanged.,29320,,,,,,,,,,,,,,,,,
RED-056,06_redcap,project_owner_redcap_branching_specification_candidate_0.2.yaml,preregistration/package/06_redcap/project_owner_redcap_branching_specification_candidate_0.2.yaml,preregistration/package/06_redcap/project_owner_redcap_branching_specification_candidate_0.2.yaml,"Machine-readable consent, branching, linkage, permission and completion specification.",owner-redcap-candidate-0.2,historical_candidate,draft_template,prospective,public,include,6880407b8e47d06510724f170f0aa8822406c0f62011e1afac55738ff9e7740d,2026-07-22T18:27:30+00:00,9fcabc3699ae2f047b7d33460c9867ab68457455,supporting_historical_candidate,RED-054; RED-068,Records PID 9149 only as a future synthetic-QA target; no connection occurred. Superseded by candidate 0.3 before recruitment; this candidate-0.2 file remains unchanged.,5793,,,,,,,,,,,,,,,,,
RED-057,06_redcap,project_owner_redcap_expected_export_candidate_0.2.csv,preregistration/package/06_redcap/project_owner_redcap_expected_export_candidate_0.2.csv,preregistration/package/06_redcap/project_owner_redcap_expected_export_candidate_0.2.csv,Expected contact consent and analytical export specification for candidate 0.2.,owner-redcap-candidate-0.2,historical_candidate,draft_template,prospective,public,include,18b9fbe9ef0bbac565495b7699b8d855d04b884d500ef2d38009535326093420,2026-07-22T18:27:30+00:00,9fcabc3699ae2f047b7d33460c9867ab68457455,supporting_historical_candidate,RED-054; RED-068,Documents native consent timestamp and deterministic current-consent/completion derivations. Superseded by candidate 0.3 before recruitment; this candidate-0.2 file remains unchanged.,16736,,,,,,,,,,,,,,,,,
RED-058,06_redcap,project_owner_synthetic_import_candidate_0.2.csv,preregistration/package/06_redcap/live_qa/project_owner_synthetic_import_candidate_0.2.csv,preregistration/package/06_redcap/live_qa/project_owner_synthetic_import_candidate_0.2.csv,Synthetic-only contact consent and assignment import fixture for later Development live QA.,owner-redcap-candidate-0.2,historical_candidate,draft_template,prospective,public,include,1a0c61835fca6866196905f274908dc2f333be699d25066dbf4e19cb1e7d5346,2026-07-22T18:27:30+00:00,9fcabc3699ae2f047b7d33460c9867ab68457455,supporting_historical_candidate,RED-054; RED-060; RED-068,"Fictional .invalid contacts and synthetic projects only; not a sample, formal assignment or response. Superseded by candidate 0.3 before recruitment; this candidate-0.2 file remains unchanged.",7876,,,,,,,,,,,,,,,,,
RED-059,06_redcap,project_owner_recruitment_materials_candidate_0.2.md,preregistration/package/06_redcap/project_owner_recruitment_materials_candidate_0.2.md,preregistration/package/06_redcap/project_owner_recruitment_materials_candidate_0.2.md,Three-stage expression-of-interest one-time consent and project-link templates.,owner-redcap-candidate-0.2,historical_candidate,draft_template,prospective,public,include,50a891369e375088162c2d42a766b29db11386be79b250d7b071d667b8d9c3ef,2026-07-22T18:28:12+00:00,9fcabc3699ae2f047b7d33460c9867ab68457455,supporting_historical_candidate,PRO-012; RED-054; RED-068,Configuration placeholders only; no email or invitation was sent. Superseded by candidate 0.3 before recruitment; this candidate-0.2 file remains unchanged.,6763,,,,,,,,,,,,,,,,,
RED-060,06_redcap,project_owner_live_qa_plan_candidate_0.2.md,preregistration/package/06_redcap/project_owner_live_qa_plan_candidate_0.2.md,preregistration/package/06_redcap/project_owner_live_qa_plan_candidate_0.2.md,Offline admin respondent-view consent and freeze QA plan for candidate 0.2.,owner-redcap-candidate-0.2,historical_candidate,draft_template,prospective,public,include,f8479149ec96d434be3832e030927bf9cf736532bbb2f9906610c7267ad4b7ad,2026-07-22T18:28:12+00:00,9fcabc3699ae2f047b7d33460c9867ab68457455,supporting_historical_candidate,RED-054; RED-058; RED-068,PID 9149 is only the intended blank Development QA target; no live QA is claimed. Superseded by candidate 0.3 before recruitment; this candidate-0.2 file remains unchanged.,4270,,,,,,,,,,,,,,,,,
RED-061,06_redcap,project_owner_redcap_candidate_0.2_README.md,preregistration/package/06_redcap/project_owner_redcap_candidate_0.2_README.md,preregistration/package/06_redcap/project_owner_redcap_candidate_0.2_README.md,Candidate-0.2 consent architecture status hashes and gate guide.,owner-redcap-candidate-0.2,historical_candidate,draft_template,prospective,public,include,d0a3e29666e28cfa6990de6a48a91f060a4d0f04135243e60a6413f9e3616544,2026-07-22T18:28:12+00:00,9fcabc3699ae2f047b7d33460c9867ab68457455,supporting_historical_candidate,RED-054; RED-060; RED-068,States explicitly that candidate 0.2 is unfrozen and not imported. Superseded by candidate 0.3 before recruitment; this candidate-0.2 file remains unchanged.,3720,,,,,,,,,,,,,,,,,
RED-062,06_redcap,build_project_owner_redcap_candidate_0_2.py,scripts/build_project_owner_redcap_candidate_0_2.py,preregistration/package/06_redcap/build_project_owner_redcap_candidate_0_2.py,Deterministic offline candidate-0.2 builder.,owner-redcap-candidate-0.2,historical_candidate,draft_template,prospective,public,include,71ba2557a76454e608148f776c7241ef77ea7f08dd6892f4e78b6bff11c374fc,2026-07-22T18:27:05+00:00,9fcabc3699ae2f047b7d33460c9867ab68457455,supporting_historical_candidate,RED-054; RED-055; RED-056; RED-057; RED-058; RED-064; RED-068,"No network, REDCap, API, sampling or real-record behaviour. Superseded by candidate 0.3 before recruitment; this candidate-0.2 file remains unchanged.",28407,,,,,,,,,,,,,,,,,
RED-063,06_redcap,validate_project_owner_redcap_candidate_0_2.py,scripts/validate_project_owner_redcap_candidate_0_2.py,preregistration/package/06_redcap/validate_project_owner_redcap_candidate_0_2.py,"Offline candidate-0.2 dictionary, consent, privacy, release-gate, fixture and completion validator.",owner-redcap-candidate-0.2,historical_candidate,draft_template,prospective,public,include,bac416e76762ba2d644b8cfbe22b1b8f87c0a5db081360ed8e5a0d423cdf0c4f,2026-07-22T18:27:05+00:00,9fcabc3699ae2f047b7d33460c9867ab68457455,supporting_historical_candidate,RED-054; RED-064; RED-068,Validates synthetic data and hash-checks candidate 0.1 and frozen scratch candidate 0.7. Superseded by candidate 0.3 before recruitment; this candidate-0.2 file remains unchanged.,15537,,,,,,,,,,,,,,,,,
RED-064,06_redcap,project_owner_candidate_0_2_synthetic_submissions.yaml,tests/fixtures/project_owner_candidate_0_2_synthetic_submissions.yaml,preregistration/package/06_redcap/test_fixtures/project_owner_candidate_0_2_synthetic_submissions.yaml,Synthetic contact consent assignment and review validation cases.,owner-redcap-candidate-0.2,historical_candidate,draft_template,prospective,public,include,7afe706a04d8f9ad40a167a303e507f67276543d545bcd4e663ad17a4c339733,2026-07-22T18:27:30+00:00,9fcabc3699ae2f047b7d33460c9867ab68457455,supporting_historical_candidate,RED-054; RED-063; RED-068,"Fictional names, .invalid emails and synthetic non-DEA identifiers only. Superseded by candidate 0.3 before recruitment; this candidate-0.2 file remains unchanged.",14440,,,,,,,,,,,,,,,,,
RED-065,06_redcap,test_project_owner_redcap_candidate_0_2.py,tests/test_project_owner_redcap_candidate_0_2.py,preregistration/package/06_redcap/test_project_owner_redcap_candidate_0_2.py,Focused offline tests for candidate-0.2 consent and preserved review design.,owner-redcap-candidate-0.2,historical_candidate,draft_template,prospective,public,include,85c0761401eb48c2fd94e4c024ab86844fc02fc96feeee857bbc065bb80619e9,2026-07-23T22:05:48+00:00,9fcabc3699ae2f047b7d33460c9867ab68457455,supporting_historical_candidate,RED-054; RED-062; RED-063; RED-064; RED-068,"Covers one-time consent, release gates, privacy, completion, fixtures and immutable candidate 0.1/scratch regressions. Superseded by candidate 0.3 before recruitment; this candidate-0.2 file remains unchanged.",19155,,,,,,,,,,,,,,,,,
RED-066,06_redcap,Project_Owner_Participant_Information_and_consent_v1.docx,preregistration/package/06_redcap/participant_materials/Project_Owner_Participant_Information_and_consent_v1.docx,preregistration/package/06_redcap/participant_materials/Project_Owner_Participant_Information_and_consent_v1.docx,Project Owner Participant Information and Consent — Version 1.,project-owner-information-v1,working_candidate,draft_template,prospective,public,include,912e4c05e5b0deae30f3024d9ca0c60eef5d91a2b43169c7df3dc631c79c1df7,2026-07-22T18:08:40+00:00,9fcabc3699ae2f047b7d33460c9867ab68457455,superseded_ethics_review_material,RED-054; RED-068; RED-083,"Retained byte-for-byte as the Version 1 candidate-0.2 ethics-review source; RED-083 is the current Version 2 Participant Information and Consent copy. Never frozen, registered or approved for recruitment.",10733,,,,,,,,,false,false,,,false,,project-owner-information-v2,,
RED-067,06_redcap,Project_Owner_Review_questionnaire_v1.docx,preregistration/package/06_redcap/participant_materials/Project_Owner_Review_questionnaire_v1.docx,preregistration/package/06_redcap/participant_materials/Project_Owner_Review_questionnaire_v1.docx,Project Owner Review Questionnaire — Version 1.,project-owner-review-questionnaire-v1,working_candidate,draft_template,prospective,public,include,a02aabe2d953d568b0abebe23531de86ad694b4d227e7b74b35bf53e65e2e154,2026-07-22T18:06:56+00:00,9fcabc3699ae2f047b7d33460c9867ab68457455,superseded_ethics_review_material,RED-054; RED-068; RED-084; RED-085,"Retained byte-for-byte as the Version 1 candidate-0.2 ethics-review source; RED-085 is the current Version 3 Questionnaire copy and RED-084 is its archived Version 2 predecessor. Never frozen, registered or approved for recruitment.",19787,,,,,,,,,false,false,,,false,,project-owner-review-questionnaire-v2; project-owner-review-questionnaire-v3,,
ANA-001,07_analysis,run_validation_analysis.py,preregistration/package/07_analysis/run_validation_analysis.py,preregistration/package/07_analysis/run_validation_analysis.py,Read-only preregistration analysis-preflight scaffold,analysis-preflight-v0.14-rc1,working_candidate,draft_template,prospective,public,include,e0a3f09d36aed6801eec193bd7634c52710356331eb21d3435e5aefb3d6b5ef8,2026-07-22T15:01:10+00:00,9fcabc3699ae2f047b7d33460c9867ab68457455,supporting_current_candidate,,"Reviewed resolution of the readiness-audit classification option: supporting static preflight scaffold, not a frozen or executable formal-analysis entry point. --check validates local rules, schemas, dependencies, candidate-0.7 and closed gates; --run is explicitly not implemented. The final executable orchestration must be completed and verified before analysis lock without changing preregistered rules.",6247,8b632011ffc52aee15ca41560c2609a85e7de9f6,,,,,,,,false,false,,,false,,,,
ANA-002,07_analysis,validation_requirements.lock,preregistration/package/07_analysis/validation_requirements.lock,preregistration/package/07_analysis/validation_requirements.lock,Pinned direct-runtime dependency record supporting the preregistration preflight and future executable analysis,validation-dependencies-v0.14-rc1,working_candidate,draft_template,prospective,public,include,629bebfe1acf2ba7eb9e1cf05d8a1b6a85cc0c7faf3a2c84c8015dde7d4e79b5,2026-07-22T12:23:16+00:00,9fcabc3699ae2f047b7d33460c9867ab68457455,supporting_current_candidate,,Supporting pinned dependency record; it does not imply that the final executable formal-analysis pipeline is complete or frozen. No package installation was performed.,183,d886bc996b62a3ffb2dfcad91acbd0122f13651d,,,,,,,,false,false,,,false,,,,
ANA-003,07_analysis,requirements-analysis.txt,requirements-analysis.txt,preregistration/package/07_analysis/supporting_requirements-analysis.txt,Existing unpinned analysis dependency list,rolling,existing,frozen,pre_existing,public,exclude,c0214fb18d9390df599e59082841150e53ff29bbfe22f778a44fbab3c0783fde,2026-06-02T08:13:40+00:00,9fcabc3699ae2f047b7d33460c9867ab68457455,supporting,ANA-002,Retained as a general project dependency input but excluded from registration because ANA-002 is the exact preregistration dependency record.,178,,,,,,,,,,,,,,,,,
ANA-004,07_analysis,instrument_sensitivity.py,analysis/validation/instrument_sensitivity.py,analysis/validation/instrument_sensitivity.py,Prospective matched-panel instrument-validity sensitivity implementation.,v0.14-rc1,working_candidate,draft_template,prospective,public,include,296bc2dafd738fce1b95323b1d36f5095f9c907d9720c33a570362053c1e8847,2026-07-22T13:41:10+00:00,9fcabc3699ae2f047b7d33460c9867ab68457455,supporting_current_candidate,,"Uses the actual frozen candidate-0.7 scratch validator, filters nonformal streams, preserves primary responses, enforces complete three-coder/model panels and recomputes replacement-panel and applicable per-label estimates.",19925,4ea15f23597ee23ee1716ee756d4b6870cb67e26,,,,,,,,false,false,,,false,,,,
ANA-005,07_analysis,test_instrument_validity_sensitivity.py,tests/test_instrument_validity_sensitivity.py,tests/test_instrument_validity_sensitivity.py,"Integration tests for frozen-validator filtering, matched-panel exclusion and metric recomputation.",v0.14-rc1,working_candidate,draft_template,prospective,public,include,26159582f5472252378c1e57f729b044f277599b865acddb96d6be07e9a237b7,2026-07-22T13:41:44+00:00,9fcabc3699ae2f047b7d33460c9867ab68457455,supporting_current_candidate,,Contains no formal sample identities or results.,6462,40c4537d2cbe1bc299773e8017f20761dd4ea59b,,,,,,,,false,false,,,false,,,,
ANA-006,07_analysis,test_run_validation_analysis_entrypoint.py,tests/test_run_validation_analysis_entrypoint.py,tests/test_run_validation_analysis_entrypoint.py,Static tests for the prospective analysis gatekeeper and Type-7 convention.,v0.14-rc1,working_candidate,draft_template,prospective,public,include,e7cc0d6bba63181857930cfd03eb09cc88ddfb16ee8bc4193bf098f95b1300ce,2026-07-22T15:01:10+00:00,9fcabc3699ae2f047b7d33460c9867ab68457455,supporting_current_candidate,,Contains no formal sample identities or results.,1409,39aa7486797661785be5b3f52b15ffa2376c1920,,,,,,,,false,false,,,false,,,,
