artifact_id,artefact_group,filename,current_path,proposed_package_path,description,version,current_state,status_at_registration,pre_existing_or_prospective,access_class,registration_inclusion,sha256,created_or_modified_at,source_commit,authoritative_status,supersedes_or_superseded_by,notes,size_bytes,git_blob_oid,protocol_source_commit,protocol_source_commit_date,protocol_source_commit_message,implementation_last_checked_commit,metadata_generated_on,protocol_status,current_implementation_basis,frozen,registered,registration_identifier,registration_timestamp,official_sample_draw_authorised,supersedes,superseded_by,pending_gates,protocol_source_kind
RED-082,06_redcap,project_owner_redcap_formatting_audit_candidate_0.3.csv,preregistration/package/06_redcap/project_owner_redcap_formatting_audit_candidate_0.3.csv,preregistration/package/06_redcap/project_owner_redcap_formatting_audit_candidate_0.3.csv,Machine-readable participant-facing semantic-HTML and formatting audit for owner-redcap-candidate-0.3.,owner-redcap-candidate-0.3,working_candidate,draft_template,prospective,public,include,6667a1e48f876f73fd455f524e934753c8f80029aca3735900c61d8760df6fcb,2026-07-23T22:38:01+00:00,9fcabc3699ae2f047b7d33460c9867ab68457455,supporting_current_candidate,RED-068; RED-077; RED-078; RED-079,"Covers all 18 participant-visible descriptive fields across Owner Consent and Project Review, including the classification overview; records headings, body text, HTML tags, correction status and remaining live-rendering assertions; confirms no block is unintentionally wholly bold.",8052,,,,,,,,,,,,,,,,,
RED-083,06_redcap,Project_Owner_Participant_Information_and_Consent_v2.docx,preregistration/package/06_redcap/participant_materials/Project_Owner_Participant_Information_and_Consent_v2.docx,preregistration/package/06_redcap/participant_materials/Project_Owner_Participant_Information_and_Consent_v2.docx,Project Owner Participant Information and Consent — Version 2 (23 July 2026).,project-owner-information-v2,working_candidate,draft_template,prospective,public,include,f6946d7a7573192df26cc7813bb000ebfb45ae8ee5a68218a7aaac98a1334649,2026-07-23T16:14:04+00:00,9fcabc3699ae2f047b7d33460c9867ab68457455,current_ethics_review_material,RED-066; RED-068,"Current ethics/DPO submission copy aligned to one personalised Survey Queue link, intended-recipient confirmation, consent once, all/some/none review and Save & Return Later. Not frozen, registered or approved for recruitment; live QA remains pending.",17095,,,,,,,,,false,false,,,false,project-owner-information-v1,,ethics and DPO review; controlled REDCap live QA; coordinated final participant-document approval,
RED-084,06_redcap,Project_Owner_Review_Questionnaire_v2.docx,preregistration/package/06_redcap/participant_materials/Project_Owner_Review_Questionnaire_v2.docx,preregistration/package/06_redcap/participant_materials/Project_Owner_Review_Questionnaire_v2.docx,Project Owner Review Questionnaire — Version 2 (23 July 2026).,project-owner-review-questionnaire-v2,existing,draft_template,prospective,public,include,cad14d0d355d6487c93a86cfb4cc9642d4e46bf16bdf66c5d07c5cd89b698f80,2026-07-23T16:53:11+00:00,9fcabc3699ae2f047b7d33460c9867ab68457455,superseded_ethics_review_material,RED-067; RED-068; RED-085,"Archived Version 2 ethics/DPO review predecessor retained byte-for-byte; superseded before submission by Questionnaire v3. Not frozen, registered or approved for recruitment.",28517,,,,,,,,,false,false,,,false,project-owner-review-questionnaire-v1,project-owner-review-questionnaire-v3,ethics and DPO review; controlled REDCap live QA; coordinated final participant-document approval,
RED-068,06_redcap,project_owner_redcap_data_dictionary_candidate_0.3.csv,preregistration/package/06_redcap/project_owner_redcap_data_dictionary_candidate_0.3.csv,preregistration/package/06_redcap/project_owner_redcap_data_dictionary_candidate_0.3.csv,"Canonical generated one-owner-record, repeating-review Project Owner REDCap dictionary.",owner-redcap-candidate-0.3,working_candidate,draft_template,prospective,public,include,97219123588878b7a086a406d08a24e66966b7b4e38e740117335a429d2e011b,2026-07-23T22:38:01+00:00,9fcabc3699ae2f047b7d33460c9867ab68457455,current_candidate,RED-002; RED-054,Exactly 108 fields across Owner Consent (11) and Project Review (97); includes three hidden deterministic summary fields and one descriptive classification overview; unfrozen and requires controlled re-import/live QA.,25740,,,,,,,,,,,,,,,,,
RED-069,06_redcap,project_owner_redcap_candidate_0.3_spec.md,preregistration/package/06_redcap/project_owner_redcap_candidate_0.3_spec.md,preregistration/package/06_redcap/project_owner_redcap_candidate_0.3_spec.md,"Candidate-0.3 architecture, taxonomy, field traceability and long-format analysis specification.",owner-redcap-candidate-0.3,working_candidate,draft_template,prospective,public,include,ecafc2765930879a61a3f883c22e0b3c7a7afca5269af849472a361a3c09db8b,2026-07-23T22:38:01+00:00,9fcabc3699ae2f047b7d33460c9867ab68457455,supporting_current_candidate,RED-068; RED-080; RED-082,"Documents separate correctness/visibility explanations, semantic participant formatting, four imported reference-boundary clauses, 22 approvals, layer-qualified mapping and purpose cardinality.",24850,,,,,,,,,,,,,,,,,
RED-070,06_redcap,project_owner_redcap_candidate_0.3_live_configuration.md,preregistration/package/06_redcap/project_owner_redcap_candidate_0.3_live_configuration.md,preregistration/package/06_redcap/project_owner_redcap_candidate_0.3_live_configuration.md,Manual PID 9149 setup and live-QA checklist for candidate 0.3.,owner-redcap-candidate-0.3,working_candidate,draft_template,prospective,public,include,48df58eff2cb470c807ed8ddc1742fae6b835b2201a12c75ca66b4a94d80b891,2026-07-23T22:38:01+00:00,9fcabc3699ae2f047b7d33460c9867ab68457455,supporting_current_candidate,RED-068; RED-071,"Records project-level settings and required runtime assertions; taxonomy wording is author-approved, but PID 9149 live QA and coordinated participant-document alignment remain pending.",13566,,,,,,,,,,,,,,,,,
RED-071,06_redcap,project_owner_synthetic_import_candidate_0.3.csv,preregistration/package/06_redcap/live_qa/project_owner_synthetic_import_candidate_0.3.csv,preregistration/package/06_redcap/live_qa/project_owner_synthetic_import_candidate_0.3.csv,Synthetic long-format owner and pre-created repeating Project Review import fixture.,owner-redcap-candidate-0.3,working_candidate,draft_template,prospective,public,include,0aa47bf0089c76bcb10a2dcf9d208005a18e976eb28cef908566501db4ba3444,2026-07-23T22:38:01+00:00,9fcabc3699ae2f047b7d33460c9867ab68457455,supporting,RED-068; RED-070,"Three pseudonymous synthetic owners, 19 assignments, 22 rows and 90 importable columns; all repeat rows contain deterministic Domain, Purpose and tag summaries matching their proposal fields; no names, emails, real Record IDs or participant responses.",32647,,,,,,,,,,,,,,,,,
RED-072,06_redcap,project_owner_taxonomy_display_v1.yaml,preregistration/package/06_redcap/project_owner_taxonomy_display_v1.yaml,preregistration/package/06_redcap/project_owner_taxonomy_display_v1.yaml,Versioned owner-facing taxonomy display source with dictionary traceability and review status.,owner-redcap-candidate-0.3,working_candidate,draft_template,prospective,public,include,45a89d6c47175d940ce41e0add8a93c419b7022d85d5619f1aac68aeba80b558,2026-07-23T22:38:01+00:00,9fcabc3699ae2f047b7d33460c9867ab68457455,supporting_current_candidate,RED-068; RED-073; RED-080,Contains 11/7/2 owner-menu entries plus two proposed-only Unclear fallbacks; all 22 approved. Four reference definitions explicitly combine the frozen definition with an imported boundary clause while microdefinitions remain unchanged.,46900,,,,,,,,,,,,,,,,,
RED-073,06_redcap,project_owner_taxonomy_reference_v1.md,preregistration/package/06_redcap/project_owner_taxonomy_reference_v1.md,preregistration/package/06_redcap/project_owner_taxonomy_reference_v1.md,Author-approved wording source for the future one-page Project Owner taxonomy reference.,owner-redcap-candidate-0.3,working_candidate,draft_template,prospective,public,include,03902c014e364bab4ee4053bd618150bd283bfb4f5e60145e11b9f1533d0a349,2026-07-23T22:38:01+00:00,9fcabc3699ae2f047b7d33460c9867ab68457455,supporting,RED-072; RED-080,"Clean participant-facing source using approved reference definitions; includes document version/date, Unclear framing, purpose cardinality and category boundaries; contains no repository filenames, build/review status or provenance footer.",8368,,,,,,,,,,,,,,,,,
RED-074,06_redcap,project_owner_redcap_field_specification_candidate_0.3.csv,preregistration/package/06_redcap/project_owner_redcap_field_specification_candidate_0.3.csv,preregistration/package/06_redcap/project_owner_redcap_field_specification_candidate_0.3.csv,"Machine-readable candidate-0.3 field scope, pre-population and response specification.",owner-redcap-candidate-0.3,working_candidate,draft_template,prospective,public,include,88154a52b62241e69ffd73e736744fab0728742e37350d123fe363ba4a3f11af,2026-07-23T22:38:01+00:00,9fcabc3699ae2f047b7d33460c9867ab68457455,supporting_current_candidate,RED-068,"Generated deterministically for 108 fields; identifies the three summaries as pre-populated display support, distinguishes correctness and public-visibility explanations and records @MAXCHECKED=2 on the missing-purpose menu.",26199,,,,,,,,,,,,,,,,,
RED-075,06_redcap,project_owner_redcap_branching_specification_candidate_0.3.yaml,preregistration/package/06_redcap/project_owner_redcap_branching_specification_candidate_0.3.yaml,preregistration/package/06_redcap/project_owner_redcap_branching_specification_candidate_0.3.yaml,"Machine-readable repeating, Survey Queue, branching and live-assertion specification.",owner-redcap-candidate-0.3,working_candidate,draft_template,prospective,public,include,8fc9997cdd86a0871b998070e84215cad30218d8f408bd12a6b0d32eaab2b44e,2026-07-23T22:38:01+00:00,9fcabc3699ae2f047b7d33460c9867ab68457455,supporting_current_candidate,RED-068; RED-070,"Records layer-qualified taxonomy mapping, consent, visibility, always-reviewed tags, missing-purpose cardinality and analytical-completion rules; PID 9149 remains a future controlled synthetic-QA target only.",7832,,,,,,,,,,,,,,,,,
RED-076,06_redcap,project_owner_redcap_expected_export_candidate_0.3.csv,preregistration/package/06_redcap/project_owner_redcap_expected_export_candidate_0.3.csv,preregistration/package/06_redcap/project_owner_redcap_expected_export_candidate_0.3.csv,Expected owner-row and repeating-review long-format export specification.,owner-redcap-candidate-0.3,working_candidate,draft_template,prospective,public,include,f95c9f85b41122eec40d035ae074f63148f8524c723a57c5b17ffaf2a18bc1d2,2026-07-23T22:38:01+00:00,9fcabc3699ae2f047b7d33460c9867ab68457455,supporting_current_candidate,RED-068,"Requires owner-row consent join, explicit response-state derivation and fitted-proposal-plus-missing purpose cardinality checking before substantive filtering.",15968,,,,,,,,,,,,,,,,,
RED-077,06_redcap,build_project_owner_redcap_candidate_0_3.py,scripts/build_project_owner_redcap_candidate_0_3.py,scripts/build_project_owner_redcap_candidate_0_3.py,Deterministic offline candidate-0.3 builder.,owner-redcap-candidate-0.3,working_candidate,draft_template,prospective,public,include,b98bfabaa68a6ea5b1f0f7be0f694d9995996ebe389f7dda49866fcf7e6a22b4,2026-07-23T22:38:01+00:00,9fcabc3699ae2f047b7d33460c9867ab68457455,supporting_current_candidate,RED-068; RED-069; RED-070; RED-071; RED-072; RED-073; RED-074; RED-075; RED-076; RED-079; RED-080; RED-082,"Uses only local frozen sources; preserves approved taxonomy wording, generates the 108-field dictionary, 90-column fixture and 18-row formatting audit, and performs no network, REDCap, API, sampling or real-record operation.",141230,,,,,,,,,,,,,,,,,
RED-078,06_redcap,validate_project_owner_redcap_candidate_0_3.py,scripts/validate_project_owner_redcap_candidate_0_3.py,scripts/validate_project_owner_redcap_candidate_0_3.py,"Offline dictionary, taxonomy, fixture, long-format and immutable-candidate validator.",owner-redcap-candidate-0.3,working_candidate,draft_template,prospective,public,include,d4f8750ddcfb42d53d38aafd4a39c76f408eeeb0215f236c68db31730fc213df,2026-07-23T22:40:37+00:00,9fcabc3699ae2f047b7d33460c9867ab68457455,supporting,RED-068; RED-071; RED-072; RED-079; RED-080; RED-082,"Validates the 108-field schema, deterministic summaries, importable fixture, sufficiency-branch isolation, live-setting documentation, semantic HTML, frozen-source hashes and candidate-0.2 preservation.",101253,,,,,,,,,,,,,,,,,
RED-079,06_redcap,test_project_owner_redcap_candidate_0_3.py,tests/test_project_owner_redcap_candidate_0_3.py,tests/test_project_owner_redcap_candidate_0_3.py,Focused offline regression tests for candidate 0.3.,owner-redcap-candidate-0.3,working_candidate,draft_template,prospective,public,include,11ede010a255aa9890479d62a2d2cdde30ed9371af10c12ced623e2de27927f6,2026-07-23T22:38:02+00:00,9fcabc3699ae2f047b7d33460c9867ab68457455,supporting,RED-068; RED-071; RED-072; RED-077; RED-078; RED-080; RED-082,"Covers all eight split explanation pairs, exact branching and placement, semantic HTML, formatting audit, visibility regression, taxonomy preservation and protected hashes.",80372,,,,,,,,,,,,,,,,,
RED-080,06_redcap,project_owner_taxonomy_human_review_v1.csv,preregistration/package/06_redcap/project_owner_taxonomy_human_review_v1.csv,preregistration/package/06_redcap/project_owner_taxonomy_human_review_v1.csv,Machine-readable human-review table for all active owner-facing taxonomy definitions.,owner-redcap-candidate-0.3,working_candidate,draft_template,prospective,public,include,70ab337aa8b06ae6797c1ded2cbd024a58d4af2c62a835483a8cfcfe01cedde1,2026-07-23T22:38:01+00:00,9fcabc3699ae2f047b7d33460c9867ab68457455,supporting_current_candidate,RED-072,"Exactly 22 approved entries; preserves frozen source and inline microdefinitions, records four combined reference definitions as frozen definition plus imported exclusion/boundary clause, and retains reviewer/date/audit notes.",36209,,,,,,,,,,,,,,,,,
RED-081,06_redcap,project_owner_invitation_email_draft.docx,preregistration/package/06_redcap/participant_materials/project_owner_invitation_email_draft.docx,preregistration/package/06_redcap/participant_materials/project_owner_invitation_email_draft.docx,Draft project-owner recruitment invitation email; reviewed unchanged for the one-link Survey Queue workflow and awaiting ethics/governance approval before use.,,working_candidate,draft_template,prospective,public,include,971f71246c3483476306fc2b535fea0e43c31a1a5a922b63b1bb6b99d2e5527b,2026-07-23T09:16:06+00:00,9fcabc3699ae2f047b7d33460c9867ab68457455,supporting_current_candidate,RED-066; RED-067; RED-068,"Participant/recruitment material draft; Balint reviewed the current wording and it was retained byte-for-byte. Not approved for participant use, not frozen and not registered; controlled REDCap live QA and ethics/governance review remain pending.",8409,,,,,,,,,false,false,,,false,,,ethics and DPO review; controlled REDCap live QA; approval for participant use,
PRO-001,00_protocol,Validation_Protocol_PreReg_v0.9.docx,,,Preserved unregistered protocol candidate preceding the 17 July post-training revision.,0.9,historical_git_only,draft_template,prospective,public,exclude,1ff1add4fdcddaa6b55d19370cd16b88cbc128b2688466d897ee579390e5285a,2026-07-14T18:36:38+00:00,b85f11a986d76eb60c84308adaac5c57f3251fb9,superseded,PRO-003,"Superseded unregistered 0.9 review candidate retained through Git history and manifest metadata under the single-canonical-protocol policy; superseded by v0.10. It was never frozen, registered, or authorised for formal sampling, assignment import, coding, or analysis.",215181,,,,,,,superseded_review_candidate,false,false,false,,,false,,v0.10,,
PRO-002,00_protocol,Validation_Protocol_PreReg_final.pdf,,preregistration/package/00_protocol/Validation_Protocol_PreReg_final.pdf,Final protocol PDF for immutable registration,final,not_yet_generated,frozen,not_applicable,public,include,,,,missing_expected_artefact,PRO-018,Generate from frozen v1.1 only for immutable registration packaging; no PDF exists yet and no OSF registration is claimed.,,,,,,,,,,,,,,,,,,
PRO-003,00_protocol,Validation_Protocol_PreReg_v0.10.docx,,,Active unregistered protocol candidate directly incorporating the 17 July 2026 diagnostic-instrument decisions.,0.10,historical_git_only,draft_template,prospective,public,exclude,432224b6fed707a94ae23e7b0dbc9ecced788fac3e75d581cd02c995a34b17c5,2026-07-17T12:45:35+00:00,b85f11a986d76eb60c84308adaac5c57f3251fb9,superseded,PRO-004,"Superseded unregistered 0.10 review candidate retained through Git history and manifest metadata under the single-canonical-protocol policy; superseded by v0.11. It was never frozen, registered, or authorised for formal sampling, assignment import, coding, or analysis.",3028028,,,,,,,superseded_review_candidate,false,false,false,,,false,v0.9,v0.11,,
PRO-004,00_protocol,Validation_Protocol_PreReg_v0.11.docx,,,Validation protocol for LLM-assisted classification of the DEA accredited research projects register,v0.11,historical_git_only,draft_template,prospective,public,exclude,03f593bdc7d1c49145eefd48bda256603994371415cb7bb312bcd58ad01f3a27,2026-07-21T20:41:34+00:00,b85f11a986d76eb60c84308adaac5c57f3251fb9,superseded,PRO-005,"Superseded unregistered v0.11 review candidate retained through Git history and manifest metadata under the single-canonical-protocol policy; superseded by v0.12. It was never frozen, registered, or authorised for formal sampling, assignment import, coding, or analysis.",410916,4c2abc3b65d42c2ccd83ffc48089d8797082611c,04132a7331f53fa42ebae2af5d169daeade5331d,2026-07-21T14:52:29+01:00,insert flowchart into prereg protocol,04132a7331f53fa42ebae2af5d169daeade5331d,2026-07-21,superseded_review_candidate,false,false,false,,,false,v0.10,v0.12,,committed_blob
PRO-005,00_protocol,Validation_Protocol_PreReg_v0.12.docx,,,"Current collaborator-review protocol candidate recording post-pilot shared calibration, frozen candidate-0.7 declaration/exposure governance, analysis treatment, and remaining preregistration gates.",v0.12,historical_git_only,draft_template,prospective,public,exclude,271b1430f2a67f8b77871862fda10ba4a3857115b380675e30cb47a0c0baae79,2026-07-22T06:52:23+00:00,b85f11a986d76eb60c84308adaac5c57f3251fb9,superseded,PRO-006,"Superseded unregistered v0.12 review candidate retained through Git history and manifest metadata under the single-canonical-protocol policy; superseded by v0.13. It was never frozen, registered, or authorised for formal sampling, assignment import, coding, or analysis.",3238430,577aa70be44ad1d55707c74ecb97002b0e1c16b1,04132a7331f53fa42ebae2af5d169daeade5331d,2026-07-21T14:52:29+01:00,insert flowchart into prereg protocol,c30b19eeb472cfd140c22521c2b9073ff3da9e63,2026-07-22,superseded_review_candidate,false,false,false,,,false,v0.11,v0.13,,committed_blob
PRO-006,00_protocol,Validation_Protocol_PreReg_v0.13.docx,,,Superseded unregistered v0.13 review candidate preserved unchanged as protocol history.,v0.13,historical_git_only,draft_template,prospective,public,exclude,f03174a00f5fb773241c770e26ed1d340f1eae1895ba4908ae8301cb4e32ade2,2026-07-22T12:44:58+00:00,b85f11a986d76eb60c84308adaac5c57f3251fb9,superseded,PRO-008,"Superseded unregistered v0.13 review candidate retained through Git history and manifest metadata under the single-canonical-protocol policy; superseded by v0.14. It was never frozen, registered, or authorised for formal sampling, assignment import, coding, or analysis.",3224312,7fdf137991eb8f102f653acaac3db6bf59a2146d,5e608493ac1cc8a8e1e744e50dc970cd851c5afa,2026-07-22T12:45:43+01:00,Freeze REDCap candidate 0.7 after completed live QA,5e608493ac1cc8a8e1e744e50dc970cd851c5afa,2026-07-22,superseded_review_candidate,false,false,false,,,false,v0.12,v0.14,,working_tree_candidate
PRO-007,00_protocol,test_protocol_v0_15_decisions.py,tests/test_protocol_v0_15_decisions.py,tests/test_protocol_v0_15_decisions.py,"Focused structural tests for preserved v0.15 decisions, separate REDCap projects, unchanged scientific design and manifest history policy.",v0.15-rc1,existing,draft_template,prospective,public,include,2bd507fefb40e6f20a65d37e84a16750aa4be3869ed902c458aefc20c5ea8519,2026-07-24T13:17:49+00:00,9fcabc3699ae2f047b7d33460c9867ab68457455,supporting,,Supporting historical test for PRO-012 and current metadata test for SAM-005; it does not supersede either artefact.,7482,fc1204e83e109806211666de4423169f3c7692a6,,,,,,,,false,false,,,false,,,,
PRO-008,00_protocol,Validation_Protocol_PreReg_v0.14.docx,,,"Current lean substantive-review protocol candidate without authorisation for formal sampling, import, coding or analysis.",v0.14,historical_git_only,draft_template,prospective,public,exclude,86a9bac4a04281e097f99477541e6413295c517ff5ea926d90482a6caa3fa11b,2026-07-22T13:12:02+00:00,b85f11a986d76eb60c84308adaac5c57f3251fb9,superseded,PRO-012,"Superseded unregistered v0.14 review candidate retained through Git history and manifest metadata under the single-canonical-protocol policy; superseded by v0.15. It was never frozen, registered, or authorised for formal sampling, assignment import, coding, or analysis.",3223284,55e3dcd2b259d5027a37251c9e520b645702faaf,5e608493ac1cc8a8e1e744e50dc970cd851c5afa,2026-07-22T12:45:43+01:00,Freeze REDCap candidate 0.7 after completed live QA,5e608493ac1cc8a8e1e744e50dc970cd851c5afa,2026-07-22,superseded_review_candidate,false,false,false,,,false,v0.13,v0.15,,working_tree_candidate
PRO-009,00_protocol,README.md,preregistration/package/00_protocol/README.md,preregistration/package/00_protocol/README.md,Protocol-directory version history and status guide.,v1.1-guide,existing,draft_template,prospective,public,include,b854d97ad10921d9dc56f8fa3c4af1c32ae8a637b082ab63b141f646d9ac8efb,2026-07-24T15:08:56+00:00,9fcabc3699ae2f047b7d33460c9867ab68457455,supporting,PRO-018; POST-007; POST-008,"Administrative package guide; it records registration, the prospective Gate 2 authorisation, the unexecuted draw and closed downstream gates but does not itself freeze, register or authorise the protocol.",3367,,,,,,,,,,,,,,,,,
PRO-010,00_protocol,verify_protocol_metadata.py,scripts/verify_protocol_metadata.py,scripts/verify_protocol_metadata.py,Offline v1.1 registered-protocol metadata and closed-gate verifier.,v1.1-verifier,existing,draft_template,prospective,public,include,9547ce67aff2136065037b5b925ab000fec2d9cb2708c4387640adb24b65469c,2026-07-24T13:53:54+00:00,9fcabc3699ae2f047b7d33460c9867ab68457455,supporting,PRO-018; POST-007,Administrative verification tooling; it changes no scientific artefact or design rule.,13518,,,,,,,,,,,,,,,,,
PRO-011,00_protocol,test_verify_protocol_metadata.py,tests/test_verify_protocol_metadata.py,tests/test_verify_protocol_metadata.py,Regression tests for registered frozen v1.1 protocol metadata and the still-closed draw-authorisation gate.,v1.1-verifier-tests,existing,draft_template,prospective,public,include,49ebaffff9c43261ef236326c0e8138e979456dcf6abd116f4dd826f0d40e6e0,2026-07-24T13:53:54+00:00,9fcabc3699ae2f047b7d33460c9867ab68457455,supporting,PRO-010; PRO-018; POST-007,Administrative verification tooling; it changes no scientific artefact or design rule.,3773,,,,,,,,,,,,,,,,,
PRO-012,00_protocol,Validation_Protocol_PreReg_v0.15.docx,preregistration/package/00_protocol/Validation_Protocol_PreReg_v0.15.docx,preregistration/package/00_protocol/Validation_Protocol_PreReg_v0.15.docx,Preserved v0.15 analysis-preflight predecessor in the protocol lineage.,v0.15,superseded,draft_template,prospective,public,include,5eff044b4f8d488e84a5b49720d35318add4f29ef53136cb6ce9c2b197409ee7,2026-07-22T14:47:41+00:00,9fcabc3699ae2f047b7d33460c9867ab68457455,superseded,PRO-008; PRO-013,"Superseded unregistered v0.15 review candidate retained byte-for-byte. It was superseded by v0.16 and was never frozen, registered or authorised for formal study activity.",3223383,0043932036143966bd3707801a26439f2bf3074c,771ecc68b5a854f464bfb499652521cac0751647,2026-07-22T15:40:26+01:00,Reconcile preregistration package provenance,771ecc68b5a854f464bfb499652521cac0751647,2026-07-22,superseded_review_candidate,false,false,false,,,false,v0.14,v0.16,,working_tree_candidate
PRO-013,00_protocol,Validation_Protocol_PreReg_v0.16.docx,preregistration/package/00_protocol/Validation_Protocol_PreReg_v0.16.docx,preregistration/package/00_protocol/Validation_Protocol_PreReg_v0.16.docx,"Archived ethics/DPO documentation predecessor aligning the Project Owner stream to one pseudonymous owner record, one Survey Queue link and repeating review rows.",v0.16,existing,draft_template,prospective,public,include,616591553a571f9e084f42a21cc701a30b57966c904759ed9c633a057ef7c9a5,2026-07-23T16:00:59+00:00,9fcabc3699ae2f047b7d33460c9867ab68457455,superseded_documentation_review_candidate,PRO-012; PRO-015,Archived unregistered v0.16 ethics/DPO documentation predecessor retained byte-for-byte. Superseded by v0.17; never the analysis-preflight implementation basis. No formal assignments were populated and no approval is claimed.,3239400,83092887d9653bcbb4cf8c9aa264a2a451f69a10,0da5870f80ffbd3b30a7c0b41245aa5fda588868,2026-07-23T16:39:00+01:00,fix display text and branch logic in v0.3,0da5870f80ffbd3b30a7c0b41245aa5fda588868,2026-07-23,,false,false,false,,,false,v0.15,v0.17,"Complete project-owner instrument implementation, live QA and freeze | Complete Jo's final substantive review | Record Jo approval | Create and freeze the final preregistration protocol | Submit and verify the official preregistration | Record the subsequent formal-sampling authorisation gate",working_tree_candidate
